<?xml version="1.0" encoding="ISO-8859-1"?>

<ApplicationProperties xmlns:xsi="http://www.w3.org/2001/XMLSchema-instance" xsi:noNamespaceSchemaLocation="../home/WEB-INF/conf/properties.xsd">
    <Web>
        <backgroundColor>#2244</backgroundColor>
        <headerColor>#7357</headerColor>
        <highlightColor>#4437</highlightColor>
        <highlighterColor>#7743</highlighterColor>
        <linkbarColor>#9980</linkbarColor>
        <sidebarColor>#2234</sidebarColor>
    </Web>
    <Path>
        <Server name="localhost" port="8080" securePort="8443"></Server>
        <cookiePath>cgi-bin_frost</cookiePath>
        <Webdriver>cgi-bin/webdriver</Webdriver>
        <FtpRootPath>/ftp/zfin</FtpRootPath>
        <imageLoadPath>/image/load</imageLoadPath>
        <loadUpFull>/image/full</loadUpFull>
        <PdfPath>/pdf/</PdfPath>
        <IndexPath>/werter</IndexPath>
    </Path>
    <Email>
        <adminEmailAddress>zfin@zfin.org</adminEmailAddress>
    </Email>
    <Logging>
        <logFileName>zfin_logger.log</logFileName>
        <logFileSize>1</logFileSize>
        <MaxLogFiles>10</MaxLogFiles>
        <logPattern>%d [%t] %-5p %c{2} - %m%n</logPattern>
    </Logging>
</ApplicationProperties>